{
  "track_id": "dream_theater_overture_1928_2",
  "title": "Overture 1928 (2)",
  "artist": "Dream Theater",
  "album": "Metropolis Pt. 2: Scenes from a Memory",
  "year": 1999,
  "source_file": "dream_theater-overture_1928.gp3",
  "source_format": "gp3",
  "total_measures": 31,
  "default_tempo_bpm": 120.0,
  "default_time_signature": "4/4",
  "sections": [],
  "measures": [
    {
      "measure_number": 1,
      "time_signature": "4/4",
      "tempo_bpm": 120.0
    },
    {
      "measure_number": 2,
      "time_signature": "6/4",
      "tempo_bpm": 120.0
    },
    {
      "measure_number": 3,
      "time_signature": "6/4",
      "tempo_bpm": 120.0
    },
    {
      "measure_number": 4,
      "time_signature": "6/4",
      "tempo_bpm": 120.0
    },
    {
      "measure_number": 5,
      "time_signature": "6/4",
      "tempo_bpm": 120.0
    },
    {
      "measure_number": 6,
      "time_signature": "6/4",
      "tempo_bpm": 120.0
    },
    {
      "measure_number": 7,
      "time_signature": "4/4",
      "tempo_bpm": 120.0
    },
    {
      "measure_number": 8,
      "time_signature": "4/4",
      "tempo_bpm": 120.0
    },
    {
      "measure_number": 9,
      "time_signature": "7/4",
      "tempo_bpm": 120.0
    },
    {
      "measure_number": 10,
      "time_signature": "4/4",
      "tempo_bpm": 120.0
    },
    {
      "measure_number": 11,
      "time_signature": "4/4",
      "tempo_bpm": 120.0
    },
    {
      "measure_number": 12,
      "time_signature": "7/4",
      "tempo_bpm": 120.0
    },
    {
      "measure_number": 13,
      "time_signature": "4/4",
      "tempo_bpm": 120.0
    },
    {
      "measure_number": 14,
      "time_signature": "4/4",
      "tempo_bpm": 120.0
    },
    {
      "measure_number": 15,
      "time_signature": "4/4",
      "tempo_bpm": 120.0
    },
    {
      "measure_number": 16,
      "time_signature": "4/4",
      "tempo_bpm": 120.0
    },
    {
      "measure_number": 17,
      "time_signature": "4/4",
      "tempo_bpm": 120.0
    },
    {
      "measure_number": 18,
      "time_signature": "4/4",
      "tempo_bpm": 120.0
    },
    {
      "measure_number": 19,
      "time_signature": "7/4",
      "tempo_bpm": 120.0
    },
    {
      "measure_number": 20,
      "time_signature": "4/4",
      "tempo_bpm": 120.0
    },
    {
      "measure_number": 21,
      "time_signature": "4/4",
      "tempo_bpm": 120.0
    },
    {
      "measure_number": 22,
      "time_signature": "4/4",
      "tempo_bpm": 120.0
    },
    {
      "measure_number": 23,
      "time_signature": "4/4",
      "tempo_bpm": 120.0
    },
    {
      "measure_number": 24,
      "time_signature": "2/2",
      "tempo_bpm": 120.0
    },
    {
      "measure_number": 25,
      "time_signature": "2/2",
      "tempo_bpm": 120.0
    },
    {
      "measure_number": 26,
      "time_signature": "4/4",
      "tempo_bpm": 120.0
    },
    {
      "measure_number": 27,
      "time_signature": "4/4",
      "tempo_bpm": 120.0
    },
    {
      "measure_number": 28,
      "time_signature": "4/4",
      "tempo_bpm": 120.0
    },
    {
      "measure_number": 29,
      "time_signature": "4/4",
      "tempo_bpm": 120.0
    },
    {
      "measure_number": 30,
      "time_signature": "4/4",
      "tempo_bpm": 120.0
    },
    {
      "measure_number": 31,
      "time_signature": "4/4",
      "tempo_bpm": 120.0
    }
  ]
}