{
  "track_id": "opeth_the_lotus_eater",
  "title": "The Lotus Eater",
  "artist": "Opeth",
  "album": "Watershed",
  "year": 2008,
  "source_file": "opeth-the_lotus_eater.gp5",
  "source_format": "gp5",
  "total_measures": 31,
  "default_tempo_bpm": 120.0,
  "default_time_signature": "2/4",
  "sections": [
    {
      "label": "Verse 1",
      "start_measure": 1,
      "end_measure": 17
    },
    {
      "label": "Break",
      "start_measure": 18,
      "end_measure": 23
    },
    {
      "label": "Verse 2",
      "start_measure": 24,
      "end_measure": 31
    }
  ],
  "measures": [
    {
      "measure_number": 1,
      "time_signature": "2/4",
      "tempo_bpm": 120.0,
      "section_label": "Verse 1"
    },
    {
      "measure_number": 2,
      "time_signature": "4/4",
      "tempo_bpm": 120.0
    },
    {
      "measure_number": 3,
      "time_signature": "4/4",
      "tempo_bpm": 120.0
    },
    {
      "measure_number": 4,
      "time_signature": "4/4",
      "tempo_bpm": 120.0
    },
    {
      "measure_number": 5,
      "time_signature": "4/4",
      "tempo_bpm": 120.0
    },
    {
      "measure_number": 6,
      "time_signature": "4/4",
      "tempo_bpm": 120.0
    },
    {
      "measure_number": 7,
      "time_signature": "4/4",
      "tempo_bpm": 120.0
    },
    {
      "measure_number": 8,
      "time_signature": "4/4",
      "tempo_bpm": 120.0
    },
    {
      "measure_number": 9,
      "time_signature": "4/4",
      "tempo_bpm": 120.0
    },
    {
      "measure_number": 10,
      "time_signature": "4/4",
      "tempo_bpm": 120.0
    },
    {
      "measure_number": 11,
      "time_signature": "4/4",
      "tempo_bpm": 120.0
    },
    {
      "measure_number": 12,
      "time_signature": "4/4",
      "tempo_bpm": 120.0
    },
    {
      "measure_number": 13,
      "time_signature": "4/4",
      "tempo_bpm": 120.0
    },
    {
      "measure_number": 14,
      "time_signature": "4/4",
      "tempo_bpm": 120.0
    },
    {
      "measure_number": 15,
      "time_signature": "4/4",
      "tempo_bpm": 120.0
    },
    {
      "measure_number": 16,
      "time_signature": "4/4",
      "tempo_bpm": 120.0
    },
    {
      "measure_number": 17,
      "time_signature": "4/4",
      "tempo_bpm": 120.0
    },
    {
      "measure_number": 18,
      "time_signature": "4/4",
      "tempo_bpm": 120.0,
      "section_label": "Break"
    },
    {
      "measure_number": 19,
      "time_signature": "4/4",
      "tempo_bpm": 120.0
    },
    {
      "measure_number": 20,
      "time_signature": "4/4",
      "tempo_bpm": 120.0
    },
    {
      "measure_number": 21,
      "time_signature": "4/4",
      "tempo_bpm": 120.0
    },
    {
      "measure_number": 22,
      "time_signature": "4/4",
      "tempo_bpm": 120.0
    },
    {
      "measure_number": 23,
      "time_signature": "4/4",
      "tempo_bpm": 120.0
    },
    {
      "measure_number": 24,
      "time_signature": "4/4",
      "tempo_bpm": 120.0,
      "section_label": "Verse 2"
    },
    {
      "measure_number": 25,
      "time_signature": "4/4",
      "tempo_bpm": 120.0
    },
    {
      "measure_number": 26,
      "time_signature": "4/4",
      "tempo_bpm": 120.0
    },
    {
      "measure_number": 27,
      "time_signature": "4/4",
      "tempo_bpm": 120.0
    },
    {
      "measure_number": 28,
      "time_signature": "4/4",
      "tempo_bpm": 120.0
    },
    {
      "measure_number": 29,
      "time_signature": "4/4",
      "tempo_bpm": 120.0
    },
    {
      "measure_number": 30,
      "time_signature": "4/4",
      "tempo_bpm": 120.0
    },
    {
      "measure_number": 31,
      "time_signature": "4/4",
      "tempo_bpm": 120.0
    }
  ]
}