{
  "track_id": "tool_parabol",
  "title": "Parabol",
  "artist": "Tool",
  "album": "Lateralus",
  "year": 2001,
  "source_file": "tool-parabola.gp5",
  "source_format": "gp5",
  "total_measures": 57,
  "default_tempo_bpm": 120.0,
  "default_time_signature": "4/4",
  "sections": [],
  "measures": [
    {
      "measure_number": 1,
      "time_signature": "4/4",
      "tempo_bpm": 120.0
    },
    {
      "measure_number": 2,
      "time_signature": "4/4",
      "tempo_bpm": 120.0
    },
    {
      "measure_number": 3,
      "time_signature": "4/4",
      "tempo_bpm": 120.0
    },
    {
      "measure_number": 4,
      "time_signature": "4/4",
      "tempo_bpm": 120.0
    },
    {
      "measure_number": 5,
      "time_signature": "4/4",
      "tempo_bpm": 120.0
    },
    {
      "measure_number": 6,
      "time_signature": "4/4",
      "tempo_bpm": 120.0
    },
    {
      "measure_number": 7,
      "time_signature": "4/4",
      "tempo_bpm": 120.0
    },
    {
      "measure_number": 8,
      "time_signature": "4/4",
      "tempo_bpm": 120.0
    },
    {
      "measure_number": 9,
      "time_signature": "4/4",
      "tempo_bpm": 120.0
    },
    {
      "measure_number": 10,
      "time_signature": "4/4",
      "tempo_bpm": 120.0
    },
    {
      "measure_number": 11,
      "time_signature": "4/4",
      "tempo_bpm": 120.0
    },
    {
      "measure_number": 12,
      "time_signature": "4/4",
      "tempo_bpm": 120.0
    },
    {
      "measure_number": 13,
      "time_signature": "4/4",
      "tempo_bpm": 120.0
    },
    {
      "measure_number": 14,
      "time_signature": "4/4",
      "tempo_bpm": 120.0
    },
    {
      "measure_number": 15,
      "time_signature": "4/4",
      "tempo_bpm": 120.0
    },
    {
      "measure_number": 16,
      "time_signature": "4/4",
      "tempo_bpm": 120.0
    },
    {
      "measure_number": 17,
      "time_signature": "4/4",
      "tempo_bpm": 120.0
    },
    {
      "measure_number": 18,
      "time_signature": "4/4",
      "tempo_bpm": 120.0
    },
    {
      "measure_number": 19,
      "time_signature": "4/4",
      "tempo_bpm": 120.0
    },
    {
      "measure_number": 20,
      "time_signature": "4/4",
      "tempo_bpm": 120.0
    },
    {
      "measure_number": 21,
      "time_signature": "4/4",
      "tempo_bpm": 120.0
    },
    {
      "measure_number": 22,
      "time_signature": "4/4",
      "tempo_bpm": 120.0
    },
    {
      "measure_number": 23,
      "time_signature": "4/4",
      "tempo_bpm": 120.0
    },
    {
      "measure_number": 24,
      "time_signature": "4/4",
      "tempo_bpm": 120.0
    },
    {
      "measure_number": 25,
      "time_signature": "4/4",
      "tempo_bpm": 120.0
    },
    {
      "measure_number": 26,
      "time_signature": "4/4",
      "tempo_bpm": 120.0
    },
    {
      "measure_number": 27,
      "time_signature": "4/4",
      "tempo_bpm": 120.0
    },
    {
      "measure_number": 28,
      "time_signature": "4/4",
      "tempo_bpm": 120.0
    },
    {
      "measure_number": 29,
      "time_signature": "4/4",
      "tempo_bpm": 120.0
    },
    {
      "measure_number": 30,
      "time_signature": "4/4",
      "tempo_bpm": 120.0
    },
    {
      "measure_number": 31,
      "time_signature": "4/4",
      "tempo_bpm": 120.0
    },
    {
      "measure_number": 32,
      "time_signature": "4/4",
      "tempo_bpm": 120.0
    },
    {
      "measure_number": 33,
      "time_signature": "4/4",
      "tempo_bpm": 120.0
    },
    {
      "measure_number": 34,
      "time_signature": "4/4",
      "tempo_bpm": 120.0
    },
    {
      "measure_number": 35,
      "time_signature": "4/4",
      "tempo_bpm": 120.0
    },
    {
      "measure_number": 36,
      "time_signature": "4/4",
      "tempo_bpm": 120.0
    },
    {
      "measure_number": 37,
      "time_signature": "4/4",
      "tempo_bpm": 120.0
    },
    {
      "measure_number": 38,
      "time_signature": "4/4",
      "tempo_bpm": 120.0
    },
    {
      "measure_number": 39,
      "time_signature": "4/4",
      "tempo_bpm": 120.0
    },
    {
      "measure_number": 40,
      "time_signature": "4/4",
      "tempo_bpm": 120.0
    },
    {
      "measure_number": 41,
      "time_signature": "4/4",
      "tempo_bpm": 120.0
    },
    {
      "measure_number": 42,
      "time_signature": "4/4",
      "tempo_bpm": 120.0
    },
    {
      "measure_number": 43,
      "time_signature": "4/4",
      "tempo_bpm": 120.0
    },
    {
      "measure_number": 44,
      "time_signature": "4/4",
      "tempo_bpm": 120.0
    },
    {
      "measure_number": 45,
      "time_signature": "4/4",
      "tempo_bpm": 120.0
    },
    {
      "measure_number": 46,
      "time_signature": "4/4",
      "tempo_bpm": 120.0
    },
    {
      "measure_number": 47,
      "time_signature": "4/4",
      "tempo_bpm": 120.0
    },
    {
      "measure_number": 48,
      "time_signature": "4/4",
      "tempo_bpm": 120.0
    },
    {
      "measure_number": 49,
      "time_signature": "4/4",
      "tempo_bpm": 120.0
    },
    {
      "measure_number": 50,
      "time_signature": "4/4",
      "tempo_bpm": 120.0
    },
    {
      "measure_number": 51,
      "time_signature": "4/4",
      "tempo_bpm": 120.0
    },
    {
      "measure_number": 52,
      "time_signature": "4/4",
      "tempo_bpm": 120.0
    },
    {
      "measure_number": 53,
      "time_signature": "4/4",
      "tempo_bpm": 120.0
    },
    {
      "measure_number": 54,
      "time_signature": "4/4",
      "tempo_bpm": 120.0
    },
    {
      "measure_number": 55,
      "time_signature": "4/4",
      "tempo_bpm": 120.0
    },
    {
      "measure_number": 56,
      "time_signature": "4/4",
      "tempo_bpm": 120.0
    },
    {
      "measure_number": 57,
      "time_signature": "4/4",
      "tempo_bpm": 120.0
    }
  ]
}